{"$schema":"https://json-schema.org/draft/2020-12/schema","$id":"https://cdn.jsdelivr.net/gh/MrChartist/global-stock-logos@main/api/v1/schema/company.schema.json","title":"Company","description":"One listed company: identity, classification, market cap, profile and logo. Unknown values are null, never guessed.","type":"object","required":["ticker","market","name","aliases","classification","listing","marketCap","profile","logo","links","freshness"],"properties":{"ticker":{"type":"string","description":"Ticker as used in the logo file name"},"market":{"type":"string","description":"Upper-case market key, for example IN, US, KOREA"},"name":{"type":"string"},"legalName":{"type":["string","null"]},"aliases":{"type":"array","items":{"type":"string"}},"country":{"type":["string","null"]},"countryCode":{"type":["string","null"],"pattern":"^[A-Z]{2}$"},"flag":{"type":["string","null"]},"exchange":{"type":["string","null"]},"currency":{"type":["string","null"],"description":"Price currency; minor units such as GBX can differ from marketCap.currency"},"isin":{"type":["string","null"],"pattern":"^[A-Z]{2}[A-Z0-9]{9}[0-9]$"},"lei":{"type":["string","null"]},"cik":{"type":["string","null"]},"wikidata":{"type":["string","null"],"pattern":"^Q[0-9]+$"},"classification":{"type":"object","required":["sector","industry"],"properties":{"sector":{"type":["string","null"]},"industry":{"type":["string","null"]}},"additionalProperties":false},"listing":{"type":"object","required":["status","delistedAt","successor","source"],"additionalProperties":false,"description":"Whether the shares still trade. A delisted company (acquired, taken private, renamed to a new ticker) keeps its file; successor is the company that took it over or its new listing.","properties":{"status":{"enum":["listed","delisted"]},"delistedAt":{"type":["string","null"],"format":"date"},"successor":{"type":["object","null"],"required":["company","url"],"properties":{"company":{"type":"string","description":"MARKET:TICKER"},"url":{"type":"string","format":"uri"}},"additionalProperties":false},"source":{"type":["string","null"],"format":"uri"}}},"marketCap":{"type":["object","null"],"required":["currency","local","usd","inr","asOf"],"properties":{"currency":{"type":["string","null"],"description":"Reporting currency of `local`"},"local":{"type":"number"},"usd":{"type":["number","null"],"description":"Approximate: converted at the daily rate in fx-rates.json"},"inr":{"type":["number","null"]},"asOf":{"type":["string","null"]}},"additionalProperties":false},"profile":{"type":"object","required":["website","founded","listingDate","headquarters","headquartersLocal","address","addressLocal","employees","ceo","chairman","slogan"],"properties":{"website":{"type":["string","null"],"format":"uri","description":"Site root only"},"founded":{"type":["integer","null"]},"listingDate":{"type":["string","null"],"format":"date","description":"First listing on an exchange, not the founding date"},"headquarters":{"type":["string","null"]},"headquartersLocal":{"type":["string","null"]},"address":{"type":["string","null"]},"addressLocal":{"type":["string","null"]},"employees":{"type":["integer","null"]},"ceo":{"type":["object","null"],"required":["name","source","confidence"],"properties":{"name":{"type":"string"},"source":{"type":"string"},"confidence":{"enum":["low","medium","high"],"description":"low = community data that may be out of date (Wikidata); medium = exchange or registry data; high = checked by hand against the company's own page or filing (source is that URL)"}},"additionalProperties":false},"chairman":{"type":["object","null"],"required":["name","source","confidence"],"properties":{"name":{"type":"string"},"source":{"type":"string"},"confidence":{"enum":["low","medium","high"],"description":"low = community data that may be out of date (Wikidata); medium = exchange or registry data; high = checked by hand against the company's own page or filing (source is that URL)"}},"additionalProperties":false},"slogan":{"type":["string","null"]}},"additionalProperties":false},"logo":{"type":"object","required":["svg","file","png","brandColor","brandColorSource","isPlaceholder","provenance","provenanceSource"],"properties":{"svg":{"type":["string","null"],"format":"uri","description":"Vector logo; null for the 107 older companies that only have a PNG (use `file`)"},"file":{"type":"object","required":["url","format"],"properties":{"url":{"type":"string","format":"uri"},"format":{"enum":["svg","png"]}},"additionalProperties":false,"description":"The logo file in the logos/ folder, always present"},"png":{"type":["object","null"],"description":"PNG URLs by pixel size (64, 128, 256, 512); present for the 3,000 largest companies","additionalProperties":{"type":"string","format":"uri"}},"brandColor":{"type":["string","null"],"pattern":"^#[0-9A-F]{6}$","description":"Taken from the logo file: an approximation, not an official brand colour"},"brandColorSource":{"type":["string","null"]},"isPlaceholder":{"type":"boolean","description":"true = generated initials badge, not a real logo"},"provenance":{"enum":["official","commons","crawled","generated"],"description":"Where the square icon comes from. official = the owner's site, press kit or an official document; commons = Wikimedia Commons; crawled = TradingView's symbol-logo service, not checked file by file; generated = initials badge. Show only official and commons when you need logos with a known source."},"provenanceSource":{"type":["string","null"],"format":"uri","description":"The page or file the logo was taken from; null for crawled and generated"},"hd":{"type":["string","null"],"format":"uri","description":"Official full logo (wordmark or lock-up, original aspect ratio): vector SVG, or an official PNG of at least 1,000 px when the company publishes no vector logo; `svg` is the square icon"}},"additionalProperties":false},"brands":{"type":"array","description":"Brands, sub-brands and subsidiaries this company owns (see /brands.json)","items":{"type":"object","required":["slug","name","kind","logo","png","url"],"properties":{"slug":{"type":"string"},"name":{"type":"string"},"kind":{"enum":["brand","subsidiary","product","service","app"]},"logo":{"type":"string","format":"uri","description":"The original logo file (SVG, or an official PNG)"},"png":{"type":"string","format":"uri","description":"256 px PNG, always present"},"url":{"type":"string","format":"uri"}},"additionalProperties":false}},"institution":{"type":["object","null"],"description":"When this listed company is also a market institution (NSE, BSE, CDSL, MCX...): its institution record","required":["slug","name","url"],"properties":{"slug":{"type":"string"},"name":{"type":"string"},"url":{"type":"string","format":"uri"}},"additionalProperties":false},"links":{"type":"object","required":["self","yahoo","website"],"properties":{"self":{"type":"string","format":"uri"},"yahoo":{"type":["string","null"]},"website":{"type":["string","null"]}},"additionalProperties":false},"sources":{"type":["object","null"],"description":"Where each profile value came from","additionalProperties":{"type":"string"}},"checks":{"type":["object","null"],"description":"A second source that disagreed with a value we hold"},"freshness":{"type":"object","required":["marketData","profile"],"properties":{"marketData":{"type":["string","null"]},"profile":{"type":["string","null"]}},"additionalProperties":false}},"additionalProperties":false}