{"ticker":"2170","market":"KSA","name":"Alujain Corporation","legalName":null,"aliases":[],"country":"Saudi Arabia","countryCode":"SA","flag":"🇸🇦","exchange":"TADAWUL","currency":"SAR","isin":"SA0007879345","lei":null,"cik":null,"wikidata":null,"classification":{"sector":"Process Industries","industry":"Chemicals: Specialty"},"listing":{"status":"listed","delistedAt":null,"successor":null,"source":null},"marketCap":{"currency":"SAR","local":1813039973,"usd":483477326,"inr":46582822795,"asOf":"2026-10-04"},"profile":{"website":null,"founded":null,"listingDate":null,"headquarters":null,"headquartersLocal":null,"address":null,"addressLocal":null,"employees":null,"ceo":null,"chairman":null,"slogan":null},"logo":{"svg":"https://cdn.jsdelivr.net/gh/MrChartist/global-stock-logos@main/logos/ksa/2170.svg","file":{"url":"https://cdn.jsdelivr.net/gh/MrChartist/global-stock-logos@main/logos/ksa/2170.svg","format":"svg"},"png":null,"brandColor":"#F0F3FA","brandColorSource":"neutral-tile","isPlaceholder":false,"provenance":"crawled","provenanceSource":null,"hd":null},"brands":[],"institution":null,"links":{"self":"https://cdn.jsdelivr.net/gh/MrChartist/global-stock-logos@main/api/v1/companies/ksa/2170.json","yahoo":"https://finance.yahoo.com/quote/2170.SR","website":null},"sources":null,"checks":null,"freshness":{"marketData":"2026-10-04","profile":"2026-10-03"}}