{"ticker":"SCCTY","market":"US","name":"Scout24 SE Unsponsored ADR","legalName":null,"aliases":[],"country":"Germany","countryCode":"DE","flag":"🇩🇪","exchange":"OTC","currency":"USD","isin":"US81064H1059","lei":null,"cik":null,"wikidata":null,"classification":{"sector":"Technology Services","industry":"Internet Software/Services"},"listing":{"status":"listed","delistedAt":null,"successor":null,"source":null},"marketCap":{"currency":"USD","local":5385698654.645521,"usd":5385698655,"inr":518909641845,"asOf":"2026-10-04"},"profile":{"website":null,"founded":null,"listingDate":null,"headquarters":null,"headquartersLocal":null,"address":null,"addressLocal":null,"employees":1111,"ceo":null,"chairman":null,"slogan":null},"logo":{"svg":"https://cdn.jsdelivr.net/gh/MrChartist/global-stock-logos@main/logos/us/SCCTY.svg","file":{"url":"https://cdn.jsdelivr.net/gh/MrChartist/global-stock-logos@main/logos/us/SCCTY.svg","format":"svg"},"png":null,"brandColor":"#FF9015","brandColorSource":"logo-tile","isPlaceholder":false,"provenance":"crawled","provenanceSource":null,"hd":null},"brands":[],"institution":null,"links":{"self":"https://cdn.jsdelivr.net/gh/MrChartist/global-stock-logos@main/api/v1/companies/us/SCCTY.json","yahoo":"https://finance.yahoo.com/quote/SCCTY","website":null},"sources":null,"checks":null,"freshness":{"marketData":"2026-10-04","profile":"2026-10-03"}}