{"ticker":"ISLMF","market":"US","name":"InSilico Medicine Cayman TopCo","legalName":null,"aliases":[],"country":"Hong Kong","countryCode":"HK","flag":"🇭🇰","exchange":"OTC","currency":"USD","isin":"KYG4790P1037","lei":null,"cik":null,"wikidata":null,"classification":{"sector":"Health Technology","industry":"Pharmaceuticals: Major"},"listing":{"status":"listed","delistedAt":null,"successor":null,"source":null},"marketCap":{"currency":"USD","local":4285641758.7840285,"usd":4285641759,"inr":412919654941,"asOf":"2026-10-04"},"profile":{"website":"https://insilico.com","founded":2018,"listingDate":null,"headquarters":null,"headquartersLocal":null,"address":null,"addressLocal":"香港新界白石角香港科学园第二期8W座3楼310室,345Park Avenue South, 2nd Floor, Suite 006New York, United States","employees":317,"ceo":null,"chairman":null,"slogan":null},"logo":{"svg":"https://cdn.jsdelivr.net/gh/MrChartist/global-stock-logos@main/logos/us/ISLMF.svg","file":{"url":"https://cdn.jsdelivr.net/gh/MrChartist/global-stock-logos@main/logos/us/ISLMF.svg","format":"svg"},"png":null,"brandColor":"#00A607","brandColorSource":"logo-artwork","isPlaceholder":false,"provenance":"crawled","provenanceSource":null,"hd":null},"brands":[],"institution":null,"links":{"self":"https://cdn.jsdelivr.net/gh/MrChartist/global-stock-logos@main/api/v1/companies/us/ISLMF.json","yahoo":"https://finance.yahoo.com/quote/ISLMF","website":"https://insilico.com"},"sources":{"website":"eastmoney","founded":"eastmoney","addressLocal":"eastmoney"},"checks":null,"freshness":{"marketData":"2026-10-04","profile":"2026-10-03"}}