{"ticker":"IAG","market":"CANADA","name":"iA Financial Corporation Inc.","legalName":null,"aliases":[],"country":"Canada","countryCode":"CA","flag":"🇨🇦","exchange":"NEO","currency":"CAD","isin":"CA45075E1043","lei":null,"cik":null,"wikidata":null,"classification":{"sector":"Finance","industry":"Investment Managers"},"listing":{"status":"listed","delistedAt":null,"successor":null,"source":null},"marketCap":{"currency":"CAD","local":17937506612,"usd":12597819875,"inr":1213794275937,"asOf":"2026-10-04"},"profile":{"website":"https://ia.ca","founded":null,"listingDate":null,"headquarters":null,"headquartersLocal":null,"address":null,"addressLocal":null,"employees":10347,"ceo":null,"chairman":null,"slogan":null},"logo":{"svg":"https://cdn.jsdelivr.net/gh/MrChartist/global-stock-logos@main/logos/canada/IAG.svg","file":{"url":"https://cdn.jsdelivr.net/gh/MrChartist/global-stock-logos@main/logos/canada/IAG.svg","format":"svg"},"png":{"64":"https://cdn.jsdelivr.net/gh/MrChartist/global-stock-logos@main/png/64/canada/IAG.png","128":"https://cdn.jsdelivr.net/gh/MrChartist/global-stock-logos@main/png/128/canada/IAG.png","256":"https://cdn.jsdelivr.net/gh/MrChartist/global-stock-logos@main/png/256/canada/IAG.png","512":"https://cdn.jsdelivr.net/gh/MrChartist/global-stock-logos@main/png/512/canada/IAG.png"},"brandColor":"#003DA5","brandColorSource":"logo-artwork","isPlaceholder":false,"provenance":"crawled","provenanceSource":null,"hd":null},"brands":[],"institution":null,"links":{"self":"https://cdn.jsdelivr.net/gh/MrChartist/global-stock-logos@main/api/v1/companies/canada/IAG.json","yahoo":"https://finance.yahoo.com/quote/IAG.TO","website":"https://ia.ca"},"sources":{"website":"tmx"},"checks":null,"freshness":{"marketData":"2026-10-04","profile":"2026-10-03"}}