{"ticker":"DEQ","market":"AUSTRIA","name":"Deutsche EuroShop AG","legalName":"Deutsche EuroShop SE","aliases":[],"country":"Germany","countryCode":"DE","flag":"🇩🇪","exchange":"VIE","currency":"EUR","isin":"DE0007480204","lei":"529900Y9QTEFHFEKQ736","cik":null,"wikidata":"Q628556","classification":{"sector":"Finance","industry":"Real Estate Development"},"listing":{"status":"listed","delistedAt":null,"successor":null,"source":null},"marketCap":{"currency":"EUR","local":1286130550,"usd":1447064366,"inr":139424000485,"asOf":"2026-10-04"},"profile":{"website":"https://www.deutsche-euroshop.de","founded":1997,"listingDate":null,"headquarters":"Hamburg","headquartersLocal":null,"address":null,"addressLocal":null,"employees":null,"ceo":null,"chairman":null,"slogan":null},"logo":{"svg":"https://cdn.jsdelivr.net/gh/MrChartist/global-stock-logos@main/logos/austria/DEQ.svg","file":{"url":"https://cdn.jsdelivr.net/gh/MrChartist/global-stock-logos@main/logos/austria/DEQ.svg","format":"svg"},"png":null,"brandColor":"#BA1122","brandColorSource":"logo-artwork","isPlaceholder":false,"provenance":"crawled","provenanceSource":null,"hd":null},"brands":[],"institution":null,"links":{"self":"https://cdn.jsdelivr.net/gh/MrChartist/global-stock-logos@main/api/v1/companies/austria/DEQ.json","yahoo":"https://finance.yahoo.com/quote/DEQ.VI","website":"https://www.deutsche-euroshop.de"},"sources":{"lei":"gleif","legalName":"gleif"},"checks":null,"freshness":{"marketData":"2026-10-04","profile":"2026-10-03"}}