{"ticker":"HOCPY","market":"US","name":"HOYA CORPORATION Sponsored ADR","legalName":null,"aliases":[],"country":"Japan","countryCode":"JP","flag":"🇯🇵","exchange":"OTC","currency":"USD","isin":"US4432511032","lei":null,"cik":null,"wikidata":null,"classification":{"sector":"Health Technology","industry":"Medical Specialties"},"listing":{"status":"listed","delistedAt":null,"successor":null,"source":null},"marketCap":{"currency":"USD","local":51082655363.94529,"usd":51082655364,"inr":4921790857126,"asOf":"2026-10-04"},"profile":{"website":null,"founded":null,"listingDate":null,"headquarters":null,"headquartersLocal":null,"address":null,"addressLocal":null,"employees":37752,"ceo":null,"chairman":null,"slogan":null},"logo":{"svg":"https://cdn.jsdelivr.net/gh/MrChartist/global-stock-logos@main/logos/us/HOCPY.svg","file":{"url":"https://cdn.jsdelivr.net/gh/MrChartist/global-stock-logos@main/logos/us/HOCPY.svg","format":"svg"},"png":null,"brandColor":"#0059BA","brandColorSource":"logo-tile","isPlaceholder":false,"provenance":"crawled","provenanceSource":null,"hd":null},"brands":[],"institution":null,"links":{"self":"https://cdn.jsdelivr.net/gh/MrChartist/global-stock-logos@main/api/v1/companies/us/HOCPY.json","yahoo":"https://finance.yahoo.com/quote/HOCPY","website":null},"sources":null,"checks":null,"freshness":{"marketData":"2026-10-04","profile":"2026-10-03"}}