{"ticker":"PNC","market":"VIETNAM","name":"Phuong Nam Cultural JSC","legalName":null,"aliases":[],"country":"Vietnam","countryCode":"VN","flag":"🇻🇳","exchange":"HOSE","currency":"VND","isin":"VN000000PNC1","lei":null,"cik":null,"wikidata":null,"classification":{"sector":"Consumer Services","industry":"Publishing: Books/Magazines"},"listing":{"status":"listed","delistedAt":null,"successor":null,"source":null},"marketCap":{"currency":"VND","local":231758223104,"usd":8934445,"inr":860829755,"asOf":"2026-10-04"},"profile":{"website":null,"founded":null,"listingDate":null,"headquarters":null,"headquartersLocal":null,"address":null,"addressLocal":null,"employees":719,"ceo":null,"chairman":null,"slogan":null},"logo":{"svg":"https://cdn.jsdelivr.net/gh/MrChartist/global-stock-logos@main/logos/vietnam/PNC.svg","file":{"url":"https://cdn.jsdelivr.net/gh/MrChartist/global-stock-logos@main/logos/vietnam/PNC.svg","format":"svg"},"png":null,"brandColor":"#3B4A8B","brandColorSource":"logo-artwork","isPlaceholder":false,"provenance":"crawled","provenanceSource":null,"hd":null},"brands":[],"institution":null,"links":{"self":"https://cdn.jsdelivr.net/gh/MrChartist/global-stock-logos@main/api/v1/companies/vietnam/PNC.json","yahoo":"https://finance.yahoo.com/quote/PNC","website":null},"sources":null,"checks":null,"freshness":{"marketData":"2026-10-04","profile":"2026-10-03"}}