{"ticker":"VCP","market":"UK","name":"Victoria PLC","legalName":null,"aliases":[],"country":"United Kingdom","countryCode":"GB","flag":"🇬🇧","exchange":"LSE","currency":"GBX","isin":"GB00BZC0LC10","lei":null,"cik":null,"wikidata":null,"classification":{"sector":"Consumer Durables","industry":"Home Furnishings"},"listing":{"status":"listed","delistedAt":null,"successor":null,"source":null},"marketCap":{"currency":"GBP","local":56711546,"usd":74974810,"inr":7223789205,"asOf":"2026-10-04"},"profile":{"website":null,"founded":null,"listingDate":null,"headquarters":null,"headquartersLocal":null,"address":null,"addressLocal":null,"employees":5025,"ceo":null,"chairman":null,"slogan":null},"logo":{"svg":"https://cdn.jsdelivr.net/gh/MrChartist/global-stock-logos@main/logos/uk/VCP.svg","file":{"url":"https://cdn.jsdelivr.net/gh/MrChartist/global-stock-logos@main/logos/uk/VCP.svg","format":"svg"},"png":null,"brandColor":"#F0F3FA","brandColorSource":"neutral-tile","isPlaceholder":false,"provenance":"crawled","provenanceSource":null,"hd":null},"brands":[],"institution":null,"links":{"self":"https://cdn.jsdelivr.net/gh/MrChartist/global-stock-logos@main/api/v1/companies/uk/VCP.json","yahoo":"https://finance.yahoo.com/quote/VCP.L","website":null},"sources":null,"checks":null,"freshness":{"marketData":"2026-10-04","profile":"2026-10-03"}}