{"ticker":"JINDRILL","market":"IN","name":"Jindal Drilling & Industries Ltd.","legalName":null,"aliases":[],"country":"India","countryCode":"IN","flag":"🇮🇳","exchange":"BSE","currency":"INR","isin":"INE742C01031","lei":null,"cik":null,"wikidata":null,"classification":{"sector":"Industrial Services","industry":"Contract Drilling"},"listing":{"status":"listed","delistedAt":null,"successor":null,"source":null},"marketCap":{"currency":"INR","local":16997417436,"usd":176414082,"inr":16997417414,"asOf":"2026-10-04"},"profile":{"website":null,"founded":null,"listingDate":"2006-12-22","headquarters":null,"headquartersLocal":null,"address":null,"addressLocal":null,"employees":744,"ceo":{"name":"Raghav Jindal","source":"https://nsearchives.nseindia.com/corporate/ixbrl/INTEGRATED_FILING_GOVERNANCE_177909_24072026172906_iXBRL_WEB.html","confidence":"high"},"chairman":{"name":"Dharam Pal Jindal","source":"https://nsearchives.nseindia.com/corporate/ixbrl/INTEGRATED_FILING_GOVERNANCE_177909_24072026172906_iXBRL_WEB.html","confidence":"high"},"slogan":null},"logo":{"svg":"https://cdn.jsdelivr.net/gh/MrChartist/global-stock-logos@main/logos/in/JINDRILL.svg","file":{"url":"https://cdn.jsdelivr.net/gh/MrChartist/global-stock-logos@main/logos/in/JINDRILL.svg","format":"svg"},"png":null,"brandColor":"#227C3F","brandColorSource":"logo-artwork","isPlaceholder":false,"provenance":"crawled","provenanceSource":null,"hd":null},"brands":[],"institution":null,"links":{"self":"https://cdn.jsdelivr.net/gh/MrChartist/global-stock-logos@main/api/v1/companies/in/JINDRILL.json","yahoo":"https://finance.yahoo.com/quote/JINDRILL.NS","website":null},"sources":{"listingDate":"nse-archive","ceo":"https://nsearchives.nseindia.com/corporate/ixbrl/INTEGRATED_FILING_GOVERNANCE_177909_24072026172906_iXBRL_WEB.html","chairman":"https://nsearchives.nseindia.com/corporate/ixbrl/INTEGRATED_FILING_GOVERNANCE_177909_24072026172906_iXBRL_WEB.html"},"checks":null,"freshness":{"marketData":"2026-10-04","profile":"2026-10-03"}}