{"ticker":"SILVERO","market":"IN","name":"Silver Oak Commercial Ltd.","legalName":null,"aliases":[],"country":"India","countryCode":"IN","flag":"🇮🇳","exchange":"BSE","currency":"INR","isin":"INE798C01017","lei":null,"cik":null,"wikidata":null,"classification":{"sector":"Distribution Services","industry":"Wholesale Distributors"},"listing":{"status":"listed","delistedAt":null,"successor":null,"source":null},"marketCap":null,"profile":{"website":null,"founded":null,"listingDate":null,"headquarters":null,"headquartersLocal":null,"address":null,"addressLocal":null,"employees":null,"ceo":null,"chairman":null,"slogan":null},"logo":{"svg":"https://cdn.jsdelivr.net/gh/MrChartist/global-stock-logos@main/logos/in/SILVERO.svg","file":{"url":"https://cdn.jsdelivr.net/gh/MrChartist/global-stock-logos@main/logos/in/SILVERO.svg","format":"svg"},"png":null,"brandColor":"#F0F3FA","brandColorSource":"neutral-tile","isPlaceholder":false,"provenance":"crawled","provenanceSource":null,"hd":null},"brands":[],"institution":null,"links":{"self":"https://cdn.jsdelivr.net/gh/MrChartist/global-stock-logos@main/api/v1/companies/in/SILVERO.json","yahoo":"https://finance.yahoo.com/quote/SILVERO.NS","website":null},"sources":null,"checks":null,"freshness":{"marketData":"2026-10-04","profile":"2026-10-03"}}