{"ticker":"3929","market":"JAPAN","name":"SocialWire Co., Ltd.","legalName":null,"aliases":[],"country":"Japan","countryCode":"JP","flag":"🇯🇵","exchange":"TSE","currency":"JPY","isin":"JP3431100001","lei":null,"cik":null,"wikidata":null,"classification":{"sector":"Commercial Services","industry":"Miscellaneous Commercial Services"},"listing":{"status":"listed","delistedAt":null,"successor":null,"source":null},"marketCap":{"currency":"JPY","local":2856934246,"usd":18102445,"inr":1744162430,"asOf":"2026-10-04"},"profile":{"website":null,"founded":null,"listingDate":null,"headquarters":null,"headquartersLocal":null,"address":null,"addressLocal":null,"employees":153,"ceo":null,"chairman":null,"slogan":null},"logo":{"svg":"https://cdn.jsdelivr.net/gh/MrChartist/global-stock-logos@main/logos/japan/3929.svg","file":{"url":"https://cdn.jsdelivr.net/gh/MrChartist/global-stock-logos@main/logos/japan/3929.svg","format":"svg"},"png":null,"brandColor":"#F0F3FA","brandColorSource":"neutral-tile","isPlaceholder":false,"provenance":"crawled","provenanceSource":null,"hd":null},"brands":[],"institution":null,"links":{"self":"https://cdn.jsdelivr.net/gh/MrChartist/global-stock-logos@main/api/v1/companies/japan/3929.json","yahoo":"https://finance.yahoo.com/quote/3929.T","website":null},"sources":null,"checks":null,"freshness":{"marketData":"2026-10-04","profile":"2026-10-03"}}