{"ticker":"ALCN","market":"EGYPT","name":"Alexandria Containers & Goods","legalName":null,"aliases":[],"country":"Egypt","countryCode":"EG","flag":"🇪🇬","exchange":"EGX","currency":"EGP","isin":"EGS42111C012","lei":null,"cik":null,"wikidata":"Q130323198","classification":{"sector":"Transportation","industry":"Other Transportation"},"listing":{"status":"listed","delistedAt":null,"successor":null,"source":null},"marketCap":{"currency":"EGP","local":101601178559,"usd":1945275973,"inr":187426464624,"asOf":"2026-10-04"},"profile":{"website":"https://alexcont.com","founded":1984,"listingDate":null,"headquarters":"Alexandria","headquartersLocal":null,"address":null,"addressLocal":null,"employees":null,"ceo":null,"chairman":null,"slogan":null},"logo":{"svg":"https://cdn.jsdelivr.net/gh/MrChartist/global-stock-logos@main/logos/egypt/ALCN.svg","file":{"url":"https://cdn.jsdelivr.net/gh/MrChartist/global-stock-logos@main/logos/egypt/ALCN.svg","format":"svg"},"png":null,"brandColor":"#ED2123","brandColorSource":"logo-artwork","isPlaceholder":false,"provenance":"crawled","provenanceSource":null,"hd":null},"brands":[],"institution":null,"links":{"self":"https://cdn.jsdelivr.net/gh/MrChartist/global-stock-logos@main/api/v1/companies/egypt/ALCN.json","yahoo":"https://finance.yahoo.com/quote/ALCN.CA","website":"https://alexcont.com"},"sources":null,"checks":null,"freshness":{"marketData":"2026-10-04","profile":"2026-10-03"}}