{"ticker":"BNC","market":"US","name":"BNB Standard Corporation","legalName":null,"aliases":[],"country":"United States","countryCode":"US","flag":"🇺🇸","exchange":"NASDAQ","currency":"USD","isin":"US86887P3091","lei":null,"cik":null,"wikidata":null,"classification":{"sector":"Producer Manufacturing","industry":"Trucks/Construction/Farm Machinery"},"listing":{"status":"listed","delistedAt":null,"successor":null,"source":null},"marketCap":{"currency":"USD","local":240867025,"usd":240867025,"inr":23207429469,"asOf":"2026-10-04"},"profile":{"website":"https://www.ceaindustries.com","founded":2009,"listingDate":null,"headquarters":null,"headquartersLocal":null,"address":"385 South Pierce Avenue, Suite C, Louisville, Colorado, USA","addressLocal":null,"employees":164,"ceo":null,"chairman":null,"slogan":null},"logo":{"svg":"https://cdn.jsdelivr.net/gh/MrChartist/global-stock-logos@main/logos/us/BNC.svg","file":{"url":"https://cdn.jsdelivr.net/gh/MrChartist/global-stock-logos@main/logos/us/BNC.svg","format":"svg"},"png":null,"brandColor":"#FFCF0D","brandColorSource":"logo-artwork","isPlaceholder":false,"provenance":"crawled","provenanceSource":null,"hd":null},"brands":[],"institution":null,"links":{"self":"https://cdn.jsdelivr.net/gh/MrChartist/global-stock-logos@main/api/v1/companies/us/BNC.json","yahoo":"https://finance.yahoo.com/quote/BNC","website":"https://www.ceaindustries.com"},"sources":{"website":"eastmoney","founded":"eastmoney","address":"eastmoney"},"checks":null,"freshness":{"marketData":"2026-10-04","profile":"2026-10-03"}}