{"ticker":"GPMTPA","market":"US","name":"Granite Point Mortgage Trust Inc. Cum Conv Red Pfd Registered Shs Series A","legalName":null,"aliases":[],"country":"United States","countryCode":"US","flag":"🇺🇸","exchange":"NYSE","currency":"USD","isin":"US38741L3050","lei":null,"cik":null,"wikidata":null,"classification":{"sector":"Finance","industry":"Real Estate Investment Trusts"},"listing":{"status":"listed","delistedAt":null,"successor":null,"source":null},"marketCap":{"currency":"USD","local":36664344,"usd":36664344,"inr":3532593045,"asOf":"2026-10-04"},"profile":{"website":null,"founded":null,"listingDate":null,"headquarters":null,"headquartersLocal":null,"address":null,"addressLocal":null,"employees":28,"ceo":null,"chairman":null,"slogan":null},"logo":{"svg":"https://cdn.jsdelivr.net/gh/MrChartist/global-stock-logos@main/logos/us/GPMTPA.svg","file":{"url":"https://cdn.jsdelivr.net/gh/MrChartist/global-stock-logos@main/logos/us/GPMTPA.svg","format":"svg"},"png":null,"brandColor":"#3D7CC9","brandColorSource":"logo-artwork","isPlaceholder":false,"provenance":"crawled","provenanceSource":null,"hd":null},"brands":[],"institution":null,"links":{"self":"https://cdn.jsdelivr.net/gh/MrChartist/global-stock-logos@main/api/v1/companies/us/GPMTPA.json","yahoo":"https://finance.yahoo.com/quote/GPMTPA","website":null},"sources":null,"checks":null,"freshness":{"marketData":"2026-10-04","profile":"2026-10-03"}}