{"ticker":"AZTE3","market":"BRAZIL","name":"Azevedo & Travassos Energia S.A","legalName":null,"aliases":[],"country":"Brazil","countryCode":"BR","flag":"🇧🇷","exchange":"BMFBOVESPA","currency":"BRL","isin":"BRAZTEACNOR4","lei":null,"cik":null,"wikidata":null,"classification":{"sector":"Energy Minerals","industry":"Oil & Gas Production"},"listing":{"status":"listed","delistedAt":null,"successor":null,"source":null},"marketCap":{"currency":"BRL","local":49614281,"usd":9503696,"inr":915676833,"asOf":"2026-10-04"},"profile":{"website":null,"founded":null,"listingDate":"2025-02-14","headquarters":null,"headquartersLocal":null,"address":null,"addressLocal":null,"employees":null,"ceo":null,"chairman":null,"slogan":null},"logo":{"svg":"https://cdn.jsdelivr.net/gh/MrChartist/global-stock-logos@main/logos/brazil/AZTE3.svg","file":{"url":"https://cdn.jsdelivr.net/gh/MrChartist/global-stock-logos@main/logos/brazil/AZTE3.svg","format":"svg"},"png":null,"brandColor":"#F38221","brandColorSource":"logo-artwork","isPlaceholder":false,"provenance":"crawled","provenanceSource":null,"hd":null},"brands":[],"institution":null,"links":{"self":"https://cdn.jsdelivr.net/gh/MrChartist/global-stock-logos@main/api/v1/companies/brazil/AZTE3.json","yahoo":"https://finance.yahoo.com/quote/AZTE3.SA","website":null},"sources":{"listingDate":"b3"},"checks":null,"freshness":{"marketData":"2026-10-04","profile":"2026-10-03"}}