{"ticker":"1ABT","market":"ITALY","name":"Abbott Laboratories","legalName":"ABBOTT LABORATORIES","aliases":["Abbott","Abbott Nutrition","Abbot Laboratories","Abbott Laboratories, Inc.","Abbott Labs","Abbott Molecular","Abbott Pharmaceuticals","I-Stat"],"country":"United States","countryCode":"US","flag":"🇺🇸","exchange":"MIL","currency":"EUR","isin":"US0028241000","lei":"HQD377W2YR662HK5JX27","cik":null,"wikidata":"Q306764","classification":{"sector":"Health Technology","industry":"Medical Specialties"},"listing":{"status":"listed","delistedAt":null,"successor":null,"source":null},"marketCap":{"currency":"EUR","local":150118672989.51825,"usd":168903057642,"inr":16273733597431,"asOf":"2026-10-04"},"profile":{"website":"https://abbott.com","founded":1888,"listingDate":null,"headquarters":"North Chicago","headquartersLocal":null,"address":null,"addressLocal":null,"employees":115000,"ceo":{"name":"Robert B. Ford","source":"https://www.sec.gov/Archives/edgar/data/1800/000130817926000064/abt-20260311.htm","confidence":"high"},"chairman":{"name":"Robert B. Ford","source":"https://www.sec.gov/Archives/edgar/data/1800/000130817926000064/abt-20260311.htm","confidence":"high"},"slogan":null},"logo":{"svg":"https://cdn.jsdelivr.net/gh/MrChartist/global-stock-logos@main/logos/italy/1ABT.svg","file":{"url":"https://cdn.jsdelivr.net/gh/MrChartist/global-stock-logos@main/logos/italy/1ABT.svg","format":"svg"},"png":null,"brandColor":"#0196D8","brandColorSource":"logo-tile","isPlaceholder":false,"provenance":"crawled","provenanceSource":null,"hd":null},"brands":[],"institution":null,"links":{"self":"https://cdn.jsdelivr.net/gh/MrChartist/global-stock-logos@main/api/v1/companies/italy/1ABT.json","yahoo":"https://finance.yahoo.com/quote/1ABT.MI","website":"https://abbott.com"},"sources":{"lei":"gleif","legalName":"gleif","ceo":"https://www.sec.gov/Archives/edgar/data/1800/000130817926000064/abt-20260311.htm","chairman":"https://www.sec.gov/Archives/edgar/data/1800/000130817926000064/abt-20260311.htm"},"checks":null,"freshness":{"marketData":"2026-10-04","profile":"2026-10-03"}}