{"ticker":"OEC","market":"US","name":"Orion S.A.","legalName":null,"aliases":[],"country":"Luxembourg","countryCode":"LU","flag":"🇱🇺","exchange":"NYSE","currency":"USD","isin":"LU1092234845","lei":null,"cik":null,"wikidata":"Q31838602","classification":{"sector":"Process Industries","industry":"Chemicals: Specialty"},"listing":{"status":"listed","delistedAt":null,"successor":null,"source":null},"marketCap":{"currency":"USD","local":327266416,"usd":327266416,"inr":31531971912,"asOf":"2026-10-04"},"profile":{"website":"http://www.orioncarbons.com","founded":2011,"listingDate":null,"headquarters":"Senningerberg","headquartersLocal":null,"address":"6, Route de Trèves Senningerberg (Municipality of Niederanven), Grand Duchy of Luxembourg","addressLocal":null,"employees":1639,"ceo":null,"chairman":{"name":"Dan F. Smith","source":"eastmoney","confidence":"medium"},"slogan":null},"logo":{"svg":"https://cdn.jsdelivr.net/gh/MrChartist/global-stock-logos@main/logos/us/OEC.svg","file":{"url":"https://cdn.jsdelivr.net/gh/MrChartist/global-stock-logos@main/logos/us/OEC.svg","format":"svg"},"png":null,"brandColor":"#01AEF0","brandColorSource":"logo-tile","isPlaceholder":false,"provenance":"crawled","provenanceSource":null,"hd":null},"brands":[],"institution":null,"links":{"self":"https://cdn.jsdelivr.net/gh/MrChartist/global-stock-logos@main/api/v1/companies/us/OEC.json","yahoo":"https://finance.yahoo.com/quote/OEC","website":"http://www.orioncarbons.com"},"sources":{"address":"eastmoney","chairman":"eastmoney"},"checks":{"foundedAlt":{"source":"eastmoney","value":2014}},"freshness":{"marketData":"2026-10-04","profile":"2026-10-03"}}