{"ticker":"ZEH2","market":"SWITZERLAND","name":"Zehnder Group AG Class A","legalName":null,"aliases":["Zehnder Group AG","Zehnder vehicles"],"country":"Switzerland","countryCode":"CH","flag":"🇨🇭","exchange":"BX","currency":"CHF","isin":"CH0276534614","lei":null,"cik":null,"wikidata":"Q184601","classification":{"sector":"Producer Manufacturing","industry":"Building Products"},"listing":{"status":"listed","delistedAt":null,"successor":null,"source":null},"marketCap":{"currency":"CHF","local":794742973,"usd":959222830,"inr":92420688020,"asOf":"2026-10-04"},"profile":{"website":"http://www.zehndergroup.com","founded":1984,"listingDate":null,"headquarters":"Gränichen","headquartersLocal":null,"address":null,"addressLocal":null,"employees":3636,"ceo":null,"chairman":null,"slogan":null},"logo":{"svg":"https://cdn.jsdelivr.net/gh/MrChartist/global-stock-logos@main/logos/switzerland/ZEH2.svg","file":{"url":"https://cdn.jsdelivr.net/gh/MrChartist/global-stock-logos@main/logos/switzerland/ZEH2.svg","format":"svg"},"png":null,"brandColor":"#E30613","brandColorSource":"logo-tile","isPlaceholder":false,"provenance":"crawled","provenanceSource":null,"hd":null},"brands":[],"institution":null,"links":{"self":"https://cdn.jsdelivr.net/gh/MrChartist/global-stock-logos@main/api/v1/companies/switzerland/ZEH2.json","yahoo":"https://finance.yahoo.com/quote/ZEH2.SW","website":"http://www.zehndergroup.com"},"sources":null,"checks":null,"freshness":{"marketData":"2026-10-04","profile":"2026-10-03"}}