{"ticker":"VIVA3","market":"BRAZIL","name":"Vivara Participacoes SA","legalName":null,"aliases":[],"country":"Brazil","countryCode":"BR","flag":"🇧🇷","exchange":"BMFBOVESPA","currency":"BRL","isin":"BRVIVAACNOR0","lei":null,"cik":null,"wikidata":null,"classification":{"sector":"Consumer Durables","industry":"Other Consumer Specialties"},"listing":{"status":"listed","delistedAt":null,"successor":null,"source":null},"marketCap":{"currency":"BRL","local":5904944611,"usd":1131101682,"inr":108981138065,"asOf":"2026-10-04"},"profile":{"website":"https://www.vivara.com.br","founded":null,"listingDate":"2019-10-10","headquarters":null,"headquartersLocal":null,"address":null,"addressLocal":null,"employees":5923,"ceo":null,"chairman":null,"slogan":null},"logo":{"svg":"https://cdn.jsdelivr.net/gh/MrChartist/global-stock-logos@main/logos/brazil/VIVA3.svg","file":{"url":"https://cdn.jsdelivr.net/gh/MrChartist/global-stock-logos@main/logos/brazil/VIVA3.svg","format":"svg"},"png":null,"brandColor":"#FFA67D","brandColorSource":"logo-tile","isPlaceholder":false,"provenance":"crawled","provenanceSource":null,"hd":null},"brands":[],"institution":null,"links":{"self":"https://cdn.jsdelivr.net/gh/MrChartist/global-stock-logos@main/api/v1/companies/brazil/VIVA3.json","yahoo":"https://finance.yahoo.com/quote/VIVA3.SA","website":"https://www.vivara.com.br"},"sources":{"website":"b3","listingDate":"b3"},"checks":null,"freshness":{"marketData":"2026-10-04","profile":"2026-10-03"}}