{"ticker":"5953","market":"JAPAN","name":"Showa Manufacturing Co., Ltd.","legalName":null,"aliases":[],"country":"Japan","countryCode":"JP","flag":"🇯🇵","exchange":"FSE","currency":"JPY","isin":"JP3367800004","lei":null,"cik":null,"wikidata":null,"classification":{"sector":"Producer Manufacturing","industry":"Industrial Machinery"},"listing":{"status":"listed","delistedAt":null,"successor":null,"source":null},"marketCap":{"currency":"JPY","local":5760878259,"usd":36502759,"inr":3517024403,"asOf":"2026-10-04"},"profile":{"website":null,"founded":null,"listingDate":null,"headquarters":null,"headquartersLocal":null,"address":null,"addressLocal":null,"employees":396,"ceo":null,"chairman":null,"slogan":null},"logo":{"svg":"https://cdn.jsdelivr.net/gh/MrChartist/global-stock-logos@main/logos/japan/5953.svg","file":{"url":"https://cdn.jsdelivr.net/gh/MrChartist/global-stock-logos@main/logos/japan/5953.svg","format":"svg"},"png":null,"brandColor":"#231815","brandColorSource":"logo-artwork","isPlaceholder":false,"provenance":"crawled","provenanceSource":null,"hd":null},"brands":[],"institution":null,"links":{"self":"https://cdn.jsdelivr.net/gh/MrChartist/global-stock-logos@main/api/v1/companies/japan/5953.json","yahoo":"https://finance.yahoo.com/quote/5953.T","website":null},"sources":null,"checks":null,"freshness":{"marketData":"2026-10-04","profile":"2026-10-03"}}