{"ticker":"IOTR","market":"US","name":"iOThree Limited","legalName":null,"aliases":[],"country":"Singapore","countryCode":"SG","flag":"🇸🇬","exchange":"NASDAQ","currency":"USD","isin":"KYG4940T1123","lei":null,"cik":"0001997637","wikidata":null,"classification":{"sector":"Technology Services","industry":"Information Technology Services"},"listing":{"status":"listed","delistedAt":null,"successor":null,"source":null},"marketCap":{"currency":"USD","local":9484554,"usd":9484554,"inr":913832510,"asOf":"2026-10-04"},"profile":{"website":null,"founded":2019,"listingDate":null,"headquarters":"Singapore, Singapore","headquartersLocal":null,"address":"140 Paya Lebar Road #07-02, AZ @ Paya Lebar, Singapore","addressLocal":null,"employees":55,"ceo":null,"chairman":{"name":"Eng Chye Koh","source":"eastmoney","confidence":"medium"},"slogan":null},"logo":{"svg":"https://cdn.jsdelivr.net/gh/MrChartist/global-stock-logos@main/logos/us/IOTR.svg","file":{"url":"https://cdn.jsdelivr.net/gh/MrChartist/global-stock-logos@main/logos/us/IOTR.svg","format":"svg"},"png":null,"brandColor":"#3D539E","brandColorSource":"logo-artwork","isPlaceholder":false,"provenance":"crawled","provenanceSource":null,"hd":null},"brands":[],"institution":null,"links":{"self":"https://cdn.jsdelivr.net/gh/MrChartist/global-stock-logos@main/api/v1/companies/us/IOTR.json","yahoo":"https://finance.yahoo.com/quote/IOTR","website":null},"sources":{"headquarters":"sec-edgar","cik":"sec-edgar","founded":"eastmoney","address":"eastmoney","chairman":"eastmoney"},"checks":null,"freshness":{"marketData":"2026-10-04","profile":"2026-10-03"}}