{"ticker":"6177","market":"TAIWAN","name":"DA-LI DEVELOPMENT Co., Ltd.","legalName":null,"aliases":[],"country":"Taiwan","countryCode":"TW","flag":"🇹🇼","exchange":"TWSE","currency":"TWD","isin":"TW0006177009","lei":null,"cik":null,"wikidata":null,"classification":{"sector":"Finance","industry":"Real Estate Development"},"listing":{"status":"listed","delistedAt":null,"successor":null,"source":null},"marketCap":{"currency":"TWD","local":21707006653,"usd":681451783,"inr":65657572639,"asOf":"2026-10-04"},"profile":{"website":null,"founded":null,"listingDate":null,"headquarters":null,"headquartersLocal":null,"address":null,"addressLocal":null,"employees":null,"ceo":null,"chairman":null,"slogan":null},"logo":{"svg":"https://cdn.jsdelivr.net/gh/MrChartist/global-stock-logos@main/logos/taiwan/6177.svg","file":{"url":"https://cdn.jsdelivr.net/gh/MrChartist/global-stock-logos@main/logos/taiwan/6177.svg","format":"svg"},"png":null,"brandColor":"#0C045E","brandColorSource":"logo-artwork","isPlaceholder":false,"provenance":"crawled","provenanceSource":null,"hd":null},"brands":[],"institution":null,"links":{"self":"https://cdn.jsdelivr.net/gh/MrChartist/global-stock-logos@main/api/v1/companies/taiwan/6177.json","yahoo":"https://finance.yahoo.com/quote/6177.TW","website":null},"sources":null,"checks":null,"freshness":{"marketData":"2026-10-04","profile":"2026-10-03"}}